名稱,地址,種類,lon,lat
私立靜修女中,臺北市大同區雙連里寧夏路59號,高中,121.5154866,",25.057931"
私立東山高中,臺北市文山區老泉里老泉街26巷3號,高中,121.5615447,24.9733741
私立滬江高中,臺北市文山區景美里羅斯福路6段336號,高中,121.5389166,24.9894519
私立大誠高中,臺北市文山區萬興里秀明路2段175號,高中,121.5781913,24.9909268
私立再興中學,臺北市文山區明義里興隆路4段2號,高中,121.558310,24.989977
私立景文高中,臺北市文山區木新里保儀路127號,高中,121.5673971,24.9853665
私立靜心高中,臺北市文山區興隆路二段46號,高中,121.5467337,24.9988631
私立文德女中,臺北市內湖區紫陽里成功路3段70號,高中,121.5895146,25.0776217
私立方濟中學,臺北市內湖區紫星里成功路三段61號,高中,121.5905296,25.0773094
私立達人女中,臺北市內湖區湖濱里內湖路2段314號,高中,121.5876596,25.0812081
私立泰北高中,臺北市士林區福林里福林路240號,高中,121.533898,25.097375
私立衛理女中,臺北市士林區翠山里至善路2段321號,高中,121.552387,25.102314
私立華興中學,臺北市士林區芝山里仰德大道1段101號,高中,121.5385223,25.1050855
私立薇閣高中,臺北市北投區中心里珠海路50號,高中,121.5039712,25.1395247
私立幼華高中,臺北市北投區北投路二段55號,高中,121.4968537,25.1334354
私立奎山實中,臺北市北投區榮華里明德路200號,高中,121.5223028,",25.112998"
市立松山家商,臺北市信義區松山路655號,高職,121.5806133,25.0350498
市立松山工農,臺北市信義區忠孝東路5段236巷15號,高職,121.572258,25.039982
市立大安高工,臺北市大安區龍圖里復興南路2段52號,高職,121.5430425,25.0320189
市立木柵高工,臺北市文山區萬芳里木柵路4段77號,高職,121.5726322,24.9968638
市立南港高工,臺北市南港區南港里興中路29號,高職,121.6072921,25.0563397
市立內湖高工,臺北市內湖區港墘里內湖路1段520號,高職,121.5753706,25.0794378
市立士林高商,臺北市士林區後港里士商路150號,高職,121.5160767,4359999999
私立育達家商,臺北市松山區美仁里寧安街12號,高職,121.5543849,25.0496313
私立東方工商,臺北市大安區信義路四段186巷8號,高職,121.5514468,25.0322561
私立喬治工商,臺北市大安區基隆路2段172號,高職,121.5545048,25.0259066
私立開平餐飲,臺北市大安區復興南路2段148巷24號,高職,121.5423269,25.0285456
私立稻江護家,臺北市中山區新生北路三段55號,高職,121.5288056,25.0655224
私立開南商工,臺北市中正區東門里濟南路1段6號,高職,121.5218475,25.0424386
私立稻江高商,臺北市大同區國昌里民權西路225巷24號,高職,121.5119253,25.0643302
私立華岡藝校,臺北市士林區建業路73巷8號,高職,121.5491247,25.1371929
私立惇敘工商,臺北市北投區泉源路221號,高職,121.5271635,25.1446525
